{
  "schema": "genomeatlas.probe-result/1",
  "endpoint_alias": "synthetic-fixture",
  "observed_at_utc": "2000-01-01T00:00:00Z",
  "command_tool_id": "example-probe",
  "exit_code": 0,
  "input_hashes": {
    "synthetic-input": "0000000000000000000000000000000000000000000000000000000000000000"
  },
  "output_hashes": {
    "synthetic-output": "0000000000000000000000000000000000000000000000000000000000000000"
  },
  "test_scope": "synthetic",
  "redacted": true,
  "claimed_result": "NOT_TESTED",
  "verification": "UNVERIFIED"
}
